{
  "model": "yunet-2023mar",
  "width": 2160,
  "height": 3840,
  "shots": [
    {
      "a": 12.333,
      "b": 18.9,
      "frames": [
        {
          "t": 12.333,
          "boxes": [
            [
              812.0,
              1104.5,
              396.2,
              512.8,
              0.93
            ]
          ],
          "diff": 0.0
        },
        {
          "t": 12.4,
          "boxes": [
            [
              814.1,
              1102.0,
              398.0,
              514.2,
              0.94
            ],
            [
              120.0,
              300.0,
              80.0,
              95.0,
              0.58
            ]
          ],
          "diff": 1.84
        },
        {
          "t": 12.467,
          "boxes": [],
          "diff": 42.11
        }
      ]
    }
  ]
}
